<?xml version="1.0" encoding="UTF-8"?>

<shipOrder xmlns:xsi="http://www.w3.org/2001/XMLSchema-instance" orderID="889923">  
  <!--xsi:noNamespaceSchemaLocation="shipOrder.xsd"-->  
  <orderPerson ID="1">George Bush</orderPerson>  
  <shipTo id="1" ID="2"> 
    <!--can have attribute or not since it does not use 'use="required"'-->  
    <name>John Adams</name>  
    <address>Oxford Street</address>  
    <city>London</city>  
    <country>UK</country> additional information
  </shipTo>  
  <item id233="2" ID="3"> 
    <title>Empire Burlesque</title>  
    <note>Special Edition</note>  
    <quantity>1</quantity>  
    <price>10312.00</price> 
  </item>  
  <item maxiya="3" ID="4"> 
    <title>Hide your heart</title>  
    <quantity>1</quantity>  
    <price>9.0000000000000000</price> 
  </item>  
  <tahahahhaahhaha ID="5"/>  
  <it23498576 ID="6"/> 
</shipOrder>
